{
  "schemaVersion": 1,
  "id": "ru",
  "lang": "ru",
  "title": {
    "pt": "Russo",
    "en": "Russian"
  },
  "description": {
    "pt": "Russo do cirílico ao texto bíblico: alfabeto, casos, verbos e João 1:1 (Sinodal).",
    "en": "Russian from Cyrillic to biblical text: alphabet, cases, verbs and John 1:1 (Synodal)."
  },
  "lessons": [
    {
      "id": 1,
      "title": {
        "pt": "O alfabeto cirílico",
        "en": "The Cyrillic alphabet",
        "es": "El alfabeto cirílico"
      },
      "subtitle": {
        "pt": "АБВ… — ler russo desde o primeiro dia",
        "en": "АБВ… — reading Russian from day one",
        "es": "АБВ… — leer ruso desde el primer día"
      },
      "section": {
        "pt": "O alfabeto",
        "en": "The alphabet",
        "es": "El alfabeto"
      },
      "body": {
        "pt": "O russo possui 33 letras. Algumas têm valor fonético regular, outras mudam de som e a pronúncia precisa ser indicada. Compare A [а] [a], E [е] [e] e Я [я] [ia] com o latim: В [в] [v] não é b, Н [н] [n] não é h, Р [р] [r] não é p, С [с] [s] não é c e Х [х] [x] nem h. Ц [ц] se lê [ts], Ч [ч] [t͡ɕ], Ш [ш] [ʂ], Щ [щ] [ɕː], Й [й] [j], Ю [ю] [ju] e Я [я] [ja]. У [у] representa [u]. Ж [ж] se lê [ʐ]. A letra ё [ё] costuma ser escrita como е [е]. O sinal ь [ь] indica palatização: день [dʲenʲ]; ъ [ъ] é um sinal, normalmente mudo. O russo em geral não marca o acento: сло́во [ˈslovə], Бо́г [bok], свет [svʲet], земля́ [zʲɪmʲlʲæ], жизнь [ʐɪzʲɨfʲ]. No começo da palavra as letras costumam ter o valor indicado na tabela, mas a posição importa: Е [е] vale [e] depois de consoante dura e [je] no início da palavra ou depois de consoante mole. Привет",
        "en": "Russian has 33 letters. Some have a regular sound, others vary, and pronunciation must be specified. Compare A [а] [a], E [е] [e] and Я [я] [ia] with Latin; В [в] is not b, Н [н] is not h, Р [р] is not p, С [с] is not c, and Х [х] is neither h nor kh. Ц [ц] is [ts], Ч [ч] [t͡ɕ], Ш [ш] [ʂ], Щ [щ] [ɕː], Й [й] [j], Ю [ю] [ju] and Я [я] [ja]. У [у] represents [u]. Ж [ж] is [ʐ]. Letter ё [ё] is usually written е [е]. Soft sign ь [ь] marks palatalization: день [dʲenʲ]; hard sign ъ [ъ] is normally mute. Stress is not marked: сло́во [ˈslovə], Бо́г [bok], свет [svʲet], земля́ [zʲɪmʲlʲæ], жизнь [ʐɪzʲɨfʲ].",
        "es": "El ruso tiene 33 letras. Unas conservan un valor fonético regular; otras cambian de sonido, por lo que hay que indicar la pronunciación. Compara А [а] [a], Е [е] [e] y Я [я] [ia] con el latín: В [в] no es b, Н [н] no es h, Р [р] no es p, С [с] no es c y Х [х] no es h. Ц [ц] se pronuncia [ts], Ч [ч] [t͡ɕ], Ш [ш] [ʂ], Щ [щ] [ɕː], Й [й] [j], Ю [ю] [ju] y Я [я] [ja]. У [у] representa [u] y Ж [ж] se pronuncia [ʐ]. La letra Ё [ё] suele escribirse Е [е]. El signo blando Ь [ь] indica palatización: день [dʲenʲ]; Ъ [ъ] es un signo y normalmente no suena. El acento no suele marcarse: сло́во [ˈslovə], Бо́г [bok], свет [svʲet], земля́ [zʲɪmʲlʲæ], жизнь [ʐɪzʲɨfʲ]."
      },
      "vocab": [
        {
          "form": "слово",
          "lemma": "слово",
          "lang": "ru",
          "pt": "palavra",
          "en": "word",
          "es": "palabra"
        },
        {
          "form": "Бог",
          "lemma": "бог",
          "lang": "ru",
          "pt": "Deus",
          "en": "God",
          "es": "Dios"
        },
        {
          "form": "свет",
          "lemma": "свет",
          "lang": "ru",
          "pt": "luz",
          "en": "light",
          "es": "luz"
        },
        {
          "form": "земля",
          "lemma": "земля",
          "lang": "ru",
          "pt": "terra",
          "en": "earth",
          "es": "tierra"
        },
        {
          "form": "день",
          "lemma": "день",
          "lang": "ru",
          "pt": "dia",
          "en": "day",
          "es": "día"
        },
        {
          "form": "жизнь",
          "lemma": "жизнь",
          "lang": "ru",
          "pt": "vida",
          "en": "life",
          "es": "vida"
        },
        {
          "form": "начало",
          "lemma": "начало",
          "lang": "ru",
          "pt": "princípio",
          "en": "beginning",
          "es": "principio"
        },
        {
          "form": "человек",
          "lemma": "человек",
          "lang": "ru",
          "pt": "ser humano",
          "en": "human being",
          "es": "ser humano"
        }
      ],
      "exercise": {
        "kind": "fill",
        "prompt": {
          "pt": "Transcreva em cirílico: Бог",
          "en": "Write in Cyrillic: God",
          "es": "Escribe en cirílico: Dios"
        },
        "answer": "Бог"
      },
      "exercises": [
        {
          "kind": "choose",
          "prompt": {
            "pt": "Que sonido tiene В?",
            "en": "What sound does В have?",
            "es": "¿Qué sonido tiene В?"
          },
          "options": [
            {
              "pt": "b",
              "en": "b",
              "es": "b"
            },
            {
              "pt": "v",
              "en": "v",
              "es": "v"
            },
            {
              "pt": "r",
              "en": "r",
              "es": "r"
            }
          ],
          "answer": 1
        },
        {
          "kind": "fill",
          "prompt": {
            "pt": "Complete: сло_о",
            "en": "Complete: сло_о",
            "es": "Completa: сло_о"
          },
          "answer": "в"
        },
        {
          "kind": "match",
          "prompt": {
            "pt": "Relaciona letra y sonido",
            "en": "Match letter and sound",
            "es": "Relaciona letra y sonido"
          },
          "pairs": [
            {
              "a": "Щ",
              "b": {
                "pt": "shch",
                "en": "shch",
                "es": "shch"
              }
            },
            {
              "a": "Ж",
              "b": {
                "pt": "zh",
                "en": "zh",
                "es": "zh"
              }
            }
          ],
          "answer": [
            "Щ",
            "Ж"
          ]
        }
      ],
      "rules": [
        {
          "n": "1",
          "text": {
            "pt": "Ь suaviza o som; Ъ não se pronuncia.",
            "en": "Ь softens the sound; Ъ is mute.",
            "es": "Ь suaviza el sonido; Ъ no se pronuncia."
          }
        },
        {
          "n": "2",
          "text": {
            "pt": "En Positions inicial y débil, Е se lee [je].",
            "en": "In word-initial and weak positions, Е is [je].",
            "es": "En posición inicial y débil, Е se pronuncia [je]."
          }
        }
      ],
      "notes": [
        {
          "label": {
            "pt": "Ligação de letras",
            "en": "Letter joining",
            "es": "Unión de letras"
          },
          "text": {
            "pt": "As letras que se ligam à seguinte mudam de forma, e é por isso que o mesmo esqueleto consonantal pode ter mais de uma pronúncia. Compare {б}-{б}-{б} com {б} isolado: a primeira é [b] e a segunda [bʲ].",
            "en": "Letters that join the following one change shape, which is why the same consonantal skeleton can have more than one pronunciation. Compare {б}-{б}-{б} with {б} in isolation: the first is [b] and the second [bʲ].",
            "es": "Las letras que se unen a la siguiente cambian de forma, y por eso el mismo esqueleto consonántico puede tener más de una pronunciación. Compara {б}-{б}-{б} con {б} aislado: la primera es [b] y la segunda [bʲ]."
          }
        }
      ],
      "examples": [
        {
          "text": "В начале был свет",
          "gloss": {
            "pt": "Havia luz no princípio",
            "en": "There was light in the beginning",
            "es": "Había luz al principio"
          }
        },
        {
          "text": "Бог есть любовь",
          "gloss": {
            "pt": "Deus é amor",
            "en": "God is love",
            "es": "Dios es amor"
          }
        }
      ],
      "tables": [
        {
          "caption": {
            "pt": "Letras essenciais",
            "en": "Essential letters",
            "es": "Letras esenciales"
          },
          "head": [
            "Letra",
            "Sonido",
            "Ejemplo",
            {
              "pt": "Glosa",
              "en": "Gloss",
              "es": "Glosa"
            }
          ],
          "rows": [
            [
              "А К М О Т",
              "[a k m o t]",
              "мама",
              "mamá"
            ],
            [
              "В Н Р С",
              "[v n r s]",
              "нос",
              "nariz"
            ],
            [
              "Г Д З И Л П Ф",
              "[g d z ʲi lʲ p f]",
              "вода",
              "agua"
            ],
            [
              "Ж Й Х Ц Ч Ш Щ Э Ю Я",
              "[ʐ j x ts t͡ɕ ʂ ɕː e ju ja]",
              "жизнь",
              "vida"
            ]
          ]
        }
      ]
    },
    {
      "id": 2,
      "title": {
        "pt": "Substantivos e casos",
        "en": "Nouns and cases",
        "es": "Sustantivos y casos"
      },
      "subtitle": {
        "pt": "Падежи — seis relaciones gramaticales",
        "en": "Падежи — six grammatical relations",
        "es": "Падежи — seis relaciones gramaticales"
      },
      "section": {
        "pt": "O nome",
        "en": "The noun",
        "es": "El nombre"
      },
      "body": {